{
  "schema_version": "deep3d.acceptance-registry/1",
  "registry_version": "v0.1-draft.1",
  "contract": {
    "id": "agent-native-3d-target-state/1",
    "baseline_date": "2026-10-27",
    "acceptance_date": "2026-11-01",
    "thresholds_are_targets": true
  },
  "registration": {
    "state": "draft",
    "frozen_at": null,
    "creates_execution": false,
    "contains_measurements": false
  },
  "thresholds": {
    "G1": {
      "registered_cases": 10,
      "min_full_successes": 8,
      "all_claimed_completed_entities_geometry_valid": true
    },
    "G2": {
      "deliveries_with_scene_parameters_features": 10,
      "min_successful_agent_free_edit_rebuilds": 8
    },
    "G3": {
      "registered_changes": 20,
      "min_correct_final_states": 18,
      "affected_dependency_recall": 1,
      "unrelated_false_positives": 0,
      "full_recompute_equivalence_required": true
    },
    "G4": {
      "feature_nodes": 1000,
      "p95_propagation_ms_exclusive_maximum": 100,
      "accuracy": 1,
      "exclude_geometry_recompute": true,
      "record_test_machine": true
    },
    "G5": {
      "registered_scenarios": 5,
      "required_recoveries": 5,
      "duplicate_publications": 0,
      "unverified_publications": 0
    },
    "G6": {
      "minimum_observed_end_to_end_seconds": 7200,
      "minimum_verified_geometry_change_commits": 10,
      "minimum_requirement_changes": 1,
      "human_stepwise_cad_operations": 0
    },
    "G7": {
      "evidence_bundle_for_every_success": true,
      "minimum_clean_environment_reproductions": 8
    }
  },
  "cases": [
    {
      "id": "C01",
      "title": "四孔安装板",
      "intent": "创建一个可编辑安装板：80×50×8 mm，XY 居中、底面 z=0。四个直径6 mm贯穿孔的中心为(±25,±15) mm，孔轴沿Z。保留板宽、板厚、孔径与孔位参数；四孔须分离且完全位于板内。",
      "intent_language": "zh-CN",
      "capability_tags": [
        "extrude",
        "boolean-cut",
        "through-hole"
      ],
      "criteria": [
        {
          "id": "C01.validity",
          "kind": "geometry.valid-solid",
          "scope": "all_completed_entities",
          "method_id": "geometry.valid-solid@1",
          "expected": {
            "all_valid": true,
            "all_closed": true,
            "all_positive_orientation": true
          },
          "required": true,
          "stage": "both"
        },
        {
          "id": "C01.count",
          "kind": "geometry.solid-count",
          "scope": "assembly",
          "method_id": "geometry.solid-count@1",
          "expected": {
            "count": 1
          },
          "required": true,
          "stage": "both"
        },
        {
          "id": "C01.bounds",
          "kind": "geometry.axis-aligned-bounds",
          "scope": "assembly",
          "method_id": "geometry.axis-aligned-bounds@1",
          "expected": {
            "units": "mm",
            "order": "xmin_ymin_zmin_xmax_ymax_zmax",
            "values": [
              -40,
              -25,
              0,
              40,
              25,
              8
            ],
            "absolute_tolerance_mm": 0.001,
            "exchange_tolerance_mm": 0.005
          },
          "required": true,
          "stage": "both"
        },
        {
          "id": "C01.volume",
          "kind": "geometry.analytic-volume",
          "scope": "assembly",
          "method_id": "geometry.analytic-volume@1",
          "expected": {
            "units": "mm3",
            "value": 31095.22131576614,
            "formula": "80*50*8 - 4*pi*(6/2)^2*8",
            "relative_tolerance": 0.000001
          },
          "required": true,
          "stage": "both"
        },
        {
          "id": "C01.holes",
          "kind": "geometry.axial-holes",
          "scope": "mounting_plate",
          "method_id": "geometry.axial-holes@1",
          "expected": {
            "axis": [
              0,
              0,
              1
            ],
            "diameter_mm": 6,
            "through": true,
            "centers_mm": [
              [
                -25,
                -15
              ],
              [
                -25,
                15
              ],
              [
                25,
                -15
              ],
              [
                25,
                15
              ]
            ],
            "count": 4
          },
          "required": true,
          "stage": "both"
        }
      ],
      "editability_probe": {
        "parameter": "plate_thickness",
        "new_value": 10,
        "unit": "mm",
        "expected_relation": "板厚和孔贯穿深度改变，孔径及XY孔位保持；原生源不依赖Agent可重建。",
        "agent_allowed": false
      },
      "delivery_requirements": [
        "goal-version-and-criterion-bindings",
        "editable-native-source",
        "scene-parameter-feature-manifest",
        "native-brep",
        "step-export",
        "independent-native-and-step-reports",
        "version-and-diff",
        "agent-free-rebuild-instructions",
        "failure-and-blocker-record"
      ],
      "reference_policy": "intent_visible_oracle_separate_no_reference_ir_in_planner_context"
    },
    {
      "id": "C02",
      "title": "旋转阶梯轴",
      "intent": "创建可编辑旋转阶梯轴：轴线Z，总长40 mm，z=0..20外径24 mm，z=20..40外径16 mm；全长有直径6 mm轴向贯穿孔。保留旋转剖面与各段尺寸的设计关系。",
      "intent_language": "zh-CN",
      "capability_tags": [
        "revolve",
        "stepped-profile",
        "coaxial-relations"
      ],
      "criteria": [
        {
          "id": "C02.validity",
          "kind": "geometry.valid-solid",
          "scope": "all_completed_entities",
          "method_id": "geometry.valid-solid@1",
          "expected": {
            "all_valid": true,
            "all_closed": true,
            "all_positive_orientation": true
          },
          "required": true,
          "stage": "both"
        },
        {
          "id": "C02.count",
          "kind": "geometry.solid-count",
          "scope": "assembly",
          "method_id": "geometry.solid-count@1",
          "expected": {
            "count": 1
          },
          "required": true,
          "stage": "both"
        },
        {
          "id": "C02.bounds",
          "kind": "geometry.axis-aligned-bounds",
          "scope": "assembly",
          "method_id": "geometry.axis-aligned-bounds@1",
          "expected": {
            "units": "mm",
            "order": "xmin_ymin_zmin_xmax_ymax_zmax",
            "values": [
              -12,
              -12,
              0,
              12,
              12,
              40
            ],
            "absolute_tolerance_mm": 0.001,
            "exchange_tolerance_mm": 0.005
          },
          "required": true,
          "stage": "both"
        },
        {
          "id": "C02.volume",
          "kind": "geometry.analytic-volume",
          "scope": "assembly",
          "method_id": "geometry.analytic-volume@1",
          "expected": {
            "units": "mm3",
            "value": 11938.052083641214,
            "formula": "pi*((24/2)^2*20 + (16/2)^2*20 - (6/2)^2*40)",
            "relative_tolerance": 0.000001
          },
          "required": true,
          "stage": "both"
        },
        {
          "id": "C02.sections",
          "kind": "geometry.coaxial-sections",
          "scope": "stepped_shaft",
          "method_id": "geometry.coaxial-sections@1",
          "expected": {
            "axis": [
              0,
              0,
              1
            ],
            "sections": [
              {
                "z_mm": [
                  0,
                  20
                ],
                "outer_diameter_mm": 24
              },
              {
                "z_mm": [
                  20,
                  40
                ],
                "outer_diameter_mm": 16
              }
            ],
            "bore_diameter_mm": 6
          },
          "required": true,
          "stage": "both"
        },
        {
          "id": "C02.intent",
          "kind": "source.parametric-intent",
          "scope": "source",
          "method_id": "source.parametric-intent@1",
          "expected": {
            "required_relation": "editable_revolved_profile_and_segment_dimensions"
          },
          "required": true,
          "stage": "source"
        }
      ],
      "editability_probe": {
        "parameter": "large_section_diameter",
        "new_value": 28,
        "unit": "mm",
        "expected_relation": "仅大径段及相关下游结果改变；孔径、总长、小径段目标保持。",
        "agent_allowed": false
      },
      "delivery_requirements": [
        "goal-version-and-criterion-bindings",
        "editable-native-source",
        "scene-parameter-feature-manifest",
        "native-brep",
        "step-export",
        "independent-native-and-step-reports",
        "version-and-diff",
        "agent-free-rebuild-instructions",
        "failure-and-blocker-record"
      ],
      "reference_policy": "intent_visible_oracle_separate_no_reference_ir_in_planner_context"
    },
    {
      "id": "C03",
      "title": "指定外角圆角的L形截面件",
      "intent": "创建L形截面实体：XY截面顶点依次为(0,0),(40,0),(40,6),(6,6),(6,30),(0,30) mm，沿Z拉伸20 mm。只把两条自由端上的四条纵向凸边圆成R2 mm，保留(6,6)内角和(0,0)共同外角；圆角须是可编辑Feature。",
      "intent_language": "zh-CN",
      "capability_tags": [
        "polygon-profile",
        "extrude",
        "semantic-edge-selection",
        "fillet"
      ],
      "criteria": [
        {
          "id": "C03.validity",
          "kind": "geometry.valid-solid",
          "scope": "all_completed_entities",
          "method_id": "geometry.valid-solid@1",
          "expected": {
            "all_valid": true,
            "all_closed": true,
            "all_positive_orientation": true
          },
          "required": true,
          "stage": "both"
        },
        {
          "id": "C03.count",
          "kind": "geometry.solid-count",
          "scope": "assembly",
          "method_id": "geometry.solid-count@1",
          "expected": {
            "count": 1
          },
          "required": true,